{
  "$schema": "https://json-schema.org/draft/2020-12/schema",
  "title": "MaterialMakingEvent",
  "description": "LEGACY pilot schema for the Track B CaCO3 mock set. Superseded by schemas/event_grammar.v1.schema.json for all new data. Retains transitional duplicate fields (process.conditions alongside planned_conditions/observed_trajectory; top-level operator_id/lab_id/batch_id alongside provenance.*) because the mock data and the legacy readiness audit (src/materials_event_modeling/track_b/event_ingest.py) still read them. grammar.event.parse_event normalizes this shape into the typed Event envelope at the boundary.",
  "type": "object",
  "required": [
    "event_id",
    "system",
    "created_at",
    "process",
    "measurements",
    "labels",
    "data_quality"
  ],
  "additionalProperties": false,
  "properties": {
    "event_id": {
      "type": "string"
    },
    "system": {
      "type": "string",
      "description": "Material system, for example calcium_carbonate."
    },
    "created_at": {
      "type": "string",
      "format": "date-time"
    },
    "operator_id": {
      "type": [
        "string",
        "null"
      ]
    },
    "lab_id": {
      "type": [
        "string",
        "null"
      ]
    },
    "batch_id": {
      "type": [
        "string",
        "null"
      ]
    },
    "pre_registered_plan_id": {
      "type": [
        "string",
        "null"
      ]
    },
    "event_group_id": {
      "type": [
        "string",
        "null"
      ],
      "description": "Replicate or planned-condition group id. Use this for retrieval and held-out-plan splits."
    },
    "provenance": {
      "type": "object",
      "description": "Collection context that must be logged before interpreting learned representations.",
      "additionalProperties": true,
      "properties": {
        "operator_id": {
          "type": [
            "string",
            "null"
          ]
        },
        "lab_id": {
          "type": [
            "string",
            "null"
          ]
        },
        "batch_id": {
          "type": [
            "string",
            "null"
          ]
        },
        "instrument_session_id": {
          "type": [
            "string",
            "null"
          ]
        },
        "measurement_day": {
          "type": [
            "string",
            "null"
          ]
        },
        "run_order": {
          "type": [
            "number",
            "null"
          ]
        },
        "source_dataset": {
          "type": [
            "string",
            "null"
          ]
        },
        "raw_export_profile": {
          "type": [
            "string",
            "null"
          ]
        }
      }
    },
    "process": {
      "type": "object",
      "required": [
        "precursors",
        "timeline"
      ],
      "additionalProperties": true,
      "properties": {
        "precursors": {
          "type": "array",
          "items": {
            "type": "object",
            "required": [
              "name"
            ],
            "additionalProperties": true,
            "properties": {
              "name": {
                "type": "string"
              },
              "lot_id": {
                "type": [
                  "string",
                  "null"
                ]
              },
              "prepared_solution_id": {
                "type": [
                  "string",
                  "null"
                ]
              },
              "nominal_concentration": {
                "type": [
                  "number",
                  "null"
                ]
              },
              "concentration_unit": {
                "type": [
                  "string",
                  "null"
                ]
              }
            }
          }
        },
        "planned_conditions": {
          "type": "object",
          "description": "Intentional design settings for the event before execution.",
          "additionalProperties": true,
          "properties": {
            "target_temperature_c": {
              "type": [
                "number",
                "null"
              ]
            },
            "target_aging_time_minutes": {
              "type": [
                "number",
                "null"
              ]
            },
            "target_mixing_intensity": {
              "type": [
                "number",
                "null"
              ]
            },
            "target_additive_level": {
              "type": [
                "number",
                "null"
              ]
            },
            "drying_route": {
              "type": [
                "string",
                "null"
              ]
            }
          }
        },
        "observed_trajectory": {
          "type": "object",
          "description": "Actually observed process trajectory and deviations during execution.",
          "additionalProperties": true,
          "properties": {
            "temperature_c": {
              "type": [
                "number",
                "null"
              ]
            },
            "initial_ph": {
              "type": [
                "number",
                "null"
              ]
            },
            "final_ph": {
              "type": [
                "number",
                "null"
              ]
            },
            "mixing_description": {
              "type": [
                "string",
                "null"
              ]
            },
            "mixing_intensity": {
              "type": [
                "number",
                "null"
              ]
            },
            "aging_time_minutes": {
              "type": [
                "number",
                "null"
              ]
            },
            "additive_level": {
              "type": [
                "number",
                "null"
              ]
            },
            "early_turbidity": {
              "type": [
                "number",
                "null"
              ]
            }
          }
        },
        "conditions": {
          "type": "object",
          "description": "Legacy flat process field kept during schema transition; prefer planned_conditions and observed_trajectory.",
          "additionalProperties": true,
          "properties": {
            "target_temperature_c": {
              "type": [
                "number",
                "null"
              ]
            },
            "initial_ph": {
              "type": [
                "number",
                "null"
              ]
            },
            "final_ph": {
              "type": [
                "number",
                "null"
              ]
            },
            "mixing_description": {
              "type": [
                "string",
                "null"
              ]
            },
            "aging_time_minutes": {
              "type": [
                "number",
                "null"
              ]
            },
            "drying_route": {
              "type": [
                "string",
                "null"
              ]
            }
          }
        },
        "timeline": {
          "type": "array",
          "items": {
            "type": "object",
            "required": [
              "timestamp",
              "event_type"
            ],
            "additionalProperties": true,
            "properties": {
              "timestamp": {
                "type": "string",
                "format": "date-time"
              },
              "event_type": {
                "type": "string"
              },
              "notes": {
                "type": [
                  "string",
                  "null"
                ]
              }
            }
          }
        }
      }
    },
    "measurements": {
      "type": "object",
      "additionalProperties": true,
      "properties": {
        "xrd": {
          "type": "array",
          "items": {
            "type": "object",
            "required": [
              "file_path"
            ],
            "additionalProperties": true,
            "properties": {
              "file_path": {
                "type": "string"
              },
              "instrument_id": {
                "type": [
                  "string",
                  "null"
                ]
              },
              "measurement_time": {
                "type": [
                  "string",
                  "null"
                ],
                "format": "date-time"
              },
              "raw_export_format": {
                "type": [
                  "string",
                  "null"
                ]
              }
            }
          }
        },
        "spectroscopy": {
          "type": "array",
          "items": {
            "type": "object",
            "additionalProperties": true
          }
        },
        "microscopy": {
          "type": "array",
          "items": {
            "type": "object",
            "additionalProperties": true
          }
        },
        "photos": {
          "type": "array",
          "items": {
            "type": "object",
            "additionalProperties": true
          }
        }
      }
    },
    "observations": {
      "type": "array",
      "description": "Event-internal observations: time points, spatial positions, modalities, or partial measurements used for masked event learning.",
      "items": {
        "type": "object",
        "required": [
          "observation_id",
          "modality"
        ],
        "additionalProperties": true,
        "properties": {
          "observation_id": {
            "type": "string"
          },
          "modality": {
            "type": "string",
            "description": "Examples: xrd, raman, ftir, sem, tem, photo, process_log, human_note."
          },
          "stage": {
            "type": [
              "string",
              "null"
            ],
            "description": "Examples: precursor, in_situ, intermediate, final, aged, after_drying."
          },
          "timestamp": {
            "type": [
              "string",
              "null"
            ],
            "format": "date-time"
          },
          "timepoint_minutes": {
            "type": [
              "number",
              "null"
            ]
          },
          "spatial_position": {
            "type": [
              "object",
              "null"
            ],
            "additionalProperties": true,
            "properties": {
              "x": {
                "type": [
                  "number",
                  "null"
                ]
              },
              "y": {
                "type": [
                  "number",
                  "null"
                ]
              },
              "unit": {
                "type": [
                  "string",
                  "null"
                ]
              }
            }
          },
          "file_path": {
            "type": [
              "string",
              "null"
            ]
          },
          "instrument_id": {
            "type": [
              "string",
              "null"
            ]
          },
          "instrument_session_id": {
            "type": [
              "string",
              "null"
            ]
          },
          "raw_export_format": {
            "type": [
              "string",
              "null"
            ]
          },
          "include_in_raw_objective": {
            "type": [
              "boolean",
              "null"
            ]
          },
          "notes": {
            "type": [
              "string",
              "null"
            ]
          }
        }
      }
    },
    "labels": {
      "type": "object",
      "required": [
        "assigned_after_raw_data_frozen",
        "human_labels"
      ],
      "additionalProperties": true,
      "properties": {
        "assigned_after_raw_data_frozen": {
          "type": "boolean"
        },
        "human_labels": {
          "type": "array",
          "items": {
            "type": "object",
            "required": [
              "labeler_id",
              "label"
            ],
            "additionalProperties": true,
            "properties": {
              "labeler_id": {
                "type": "string"
              },
              "label": {
                "type": "string"
              },
              "confidence": {
                "type": [
                  "number",
                  "null"
                ]
              },
              "notes": {
                "type": [
                  "string",
                  "null"
                ]
              }
            }
          }
        }
      }
    },
    "data_quality": {
      "type": "object",
      "required": [
        "include_in_raw_objective",
        "deviations",
        "missing_fields"
      ],
      "additionalProperties": true,
      "properties": {
        "include_in_raw_objective": {
          "type": "boolean"
        },
        "deviations": {
          "type": "array",
          "items": {
            "type": "string"
          }
        },
        "missing_fields": {
          "type": "array",
          "items": {
            "type": "string"
          }
        }
      }
    }
  }
}
