[
  {
    "event_id": "cc_mock_0001",
    "system": "calcium_carbonate",
    "created_at": "2026-06-01T09:00:00Z",
    "operator_id": "operator_a",
    "lab_id": "lab_placeholder",
    "batch_id": "cc_mock_batch_01",
    "pre_registered_plan_id": "cc_plan_screen_01",
    "process": {
      "precursors": [
        {
          "name": "calcium_source_solution",
          "lot_id": "lot_placeholder_ca_01",
          "prepared_solution_id": "solution_ca_A",
          "nominal_concentration": null,
          "concentration_unit": null
        },
        {
          "name": "carbonate_source_solution",
          "lot_id": "lot_placeholder_co3_01",
          "prepared_solution_id": "solution_co3_A",
          "nominal_concentration": null,
          "concentration_unit": null
        }
      ],
      "conditions": {
        "target_temperature_c": 25.0,
        "initial_ph": null,
        "final_ph": null,
        "mixing_description": "mock_low_agitation",
        "aging_time_minutes": 30.0,
        "drying_route": "mock_route_air_dry",
        "planned_factor_level": "low_supersaturation_short_age"
      },
      "timeline": [
        {
          "timestamp": "2026-06-01T09:00:00Z",
          "event_type": "event_started",
          "notes": "Synthetic mock record for schema testing."
        },
        {
          "timestamp": "2026-06-01T09:30:00Z",
          "event_type": "aging_complete",
          "notes": "Mock observation: faint turbidity."
        }
      ]
    },
    "measurements": {
      "xrd": [
        {
          "file_path": "raw/track_b/mock/cc_mock_0001/xrd.raw",
          "instrument_id": "xrd_placeholder",
          "measurement_time": "2026-06-01T11:00:00Z",
          "raw_export_format": "placeholder_raw"
        }
      ],
      "spectroscopy": [],
      "microscopy": [],
      "photos": [
        {
          "file_path": "raw/track_b/mock/cc_mock_0001/photo_aging_complete.jpg",
          "timestamp": "2026-06-01T09:30:00Z"
        }
      ]
    },
    "labels": {
      "assigned_after_raw_data_frozen": true,
      "human_labels": [
        {
          "labeler_id": "labeler_placeholder",
          "label": "ambiguous_low_signal",
          "confidence": 0.4,
          "notes": "Mock label used only as a downstream probe."
        }
      ]
    },
    "data_quality": {
      "include_in_raw_objective": true,
      "deviations": [],
      "missing_fields": [
        "initial_ph",
        "final_ph"
      ]
    }
  },
  {
    "event_id": "cc_mock_0002",
    "system": "calcium_carbonate",
    "created_at": "2026-06-01T10:00:00Z",
    "operator_id": "operator_a",
    "lab_id": "lab_placeholder",
    "batch_id": "cc_mock_batch_01",
    "pre_registered_plan_id": "cc_plan_screen_01",
    "process": {
      "precursors": [
        {
          "name": "calcium_source_solution",
          "lot_id": "lot_placeholder_ca_01",
          "prepared_solution_id": "solution_ca_A",
          "nominal_concentration": null,
          "concentration_unit": null
        },
        {
          "name": "carbonate_source_solution",
          "lot_id": "lot_placeholder_co3_01",
          "prepared_solution_id": "solution_co3_A",
          "nominal_concentration": null,
          "concentration_unit": null
        }
      ],
      "conditions": {
        "target_temperature_c": 25.0,
        "initial_ph": null,
        "final_ph": null,
        "mixing_description": "mock_medium_agitation",
        "aging_time_minutes": 120.0,
        "drying_route": "mock_route_air_dry",
        "planned_factor_level": "low_supersaturation_long_age"
      },
      "timeline": [
        {
          "timestamp": "2026-06-01T10:00:00Z",
          "event_type": "event_started",
          "notes": "Synthetic mock record for schema testing."
        },
        {
          "timestamp": "2026-06-01T12:00:00Z",
          "event_type": "aging_complete",
          "notes": "Mock observation: visible precipitate."
        }
      ]
    },
    "measurements": {
      "xrd": [
        {
          "file_path": "raw/track_b/mock/cc_mock_0002/xrd.raw",
          "instrument_id": "xrd_placeholder",
          "measurement_time": "2026-06-01T14:00:00Z",
          "raw_export_format": "placeholder_raw"
        }
      ],
      "spectroscopy": [],
      "microscopy": [
        {
          "file_path": "raw/track_b/mock/cc_mock_0002/micrograph_01.tif",
          "instrument_id": "microscope_placeholder"
        }
      ],
      "photos": []
    },
    "labels": {
      "assigned_after_raw_data_frozen": true,
      "human_labels": [
        {
          "labeler_id": "labeler_placeholder",
          "label": "possible_mixture",
          "confidence": 0.55,
          "notes": "Mock label used only as a downstream probe."
        }
      ]
    },
    "data_quality": {
      "include_in_raw_objective": true,
      "deviations": [],
      "missing_fields": [
        "initial_ph",
        "final_ph"
      ]
    }
  },
  {
    "event_id": "cc_mock_0003",
    "system": "calcium_carbonate",
    "created_at": "2026-06-01T11:00:00Z",
    "operator_id": "operator_b",
    "lab_id": "lab_placeholder",
    "batch_id": "cc_mock_batch_01",
    "pre_registered_plan_id": "cc_plan_screen_01",
    "process": {
      "precursors": [
        {
          "name": "calcium_source_solution",
          "lot_id": "lot_placeholder_ca_02",
          "prepared_solution_id": "solution_ca_B",
          "nominal_concentration": null,
          "concentration_unit": null
        },
        {
          "name": "carbonate_source_solution",
          "lot_id": "lot_placeholder_co3_01",
          "prepared_solution_id": "solution_co3_A",
          "nominal_concentration": null,
          "concentration_unit": null
        }
      ],
      "conditions": {
        "target_temperature_c": 35.0,
        "initial_ph": null,
        "final_ph": null,
        "mixing_description": "mock_high_agitation",
        "aging_time_minutes": 30.0,
        "drying_route": "mock_route_filtered_then_dry",
        "planned_factor_level": "temperature_shift_short_age"
      },
      "timeline": [
        {
          "timestamp": "2026-06-01T11:00:00Z",
          "event_type": "event_started",
          "notes": "Synthetic mock record for schema testing."
        },
        {
          "timestamp": "2026-06-01T11:30:00Z",
          "event_type": "aging_complete",
          "notes": "Mock observation: rapid clouding."
        }
      ]
    },
    "measurements": {
      "xrd": [
        {
          "file_path": "raw/track_b/mock/cc_mock_0003/xrd.raw",
          "instrument_id": "xrd_placeholder",
          "measurement_time": "2026-06-01T13:00:00Z",
          "raw_export_format": "placeholder_raw"
        }
      ],
      "spectroscopy": [
        {
          "file_path": "raw/track_b/mock/cc_mock_0003/raman.txt",
          "instrument_id": "raman_placeholder"
        }
      ],
      "microscopy": [],
      "photos": []
    },
    "labels": {
      "assigned_after_raw_data_frozen": true,
      "human_labels": [
        {
          "labeler_id": "labeler_placeholder",
          "label": "mixed_or_transition_state",
          "confidence": 0.45,
          "notes": "Mock label used only as a downstream probe."
        }
      ]
    },
    "data_quality": {
      "include_in_raw_objective": true,
      "deviations": [
        "mock_temperature_ramp_uncertain"
      ],
      "missing_fields": [
        "initial_ph",
        "final_ph"
      ]
    }
  },
  {
    "event_id": "cc_mock_0004",
    "system": "calcium_carbonate",
    "created_at": "2026-06-02T09:00:00Z",
    "operator_id": "operator_a",
    "lab_id": "lab_placeholder",
    "batch_id": "cc_mock_batch_02",
    "pre_registered_plan_id": "cc_plan_screen_01",
    "process": {
      "precursors": [
        {
          "name": "calcium_source_solution",
          "lot_id": "lot_placeholder_ca_02",
          "prepared_solution_id": "solution_ca_B",
          "nominal_concentration": null,
          "concentration_unit": null
        },
        {
          "name": "carbonate_source_solution",
          "lot_id": "lot_placeholder_co3_02",
          "prepared_solution_id": "solution_co3_B",
          "nominal_concentration": null,
          "concentration_unit": null
        },
        {
          "name": "additive_placeholder",
          "lot_id": "lot_placeholder_additive_01",
          "prepared_solution_id": "solution_additive_A",
          "nominal_concentration": null,
          "concentration_unit": null
        }
      ],
      "conditions": {
        "target_temperature_c": 25.0,
        "initial_ph": null,
        "final_ph": null,
        "mixing_description": "mock_medium_agitation",
        "aging_time_minutes": 240.0,
        "drying_route": "mock_route_filtered_then_dry",
        "planned_factor_level": "additive_long_age"
      },
      "timeline": [
        {
          "timestamp": "2026-06-02T09:00:00Z",
          "event_type": "event_started",
          "notes": "Synthetic mock record for schema testing."
        },
        {
          "timestamp": "2026-06-02T13:00:00Z",
          "event_type": "aging_complete",
          "notes": "Mock observation: slow settling."
        }
      ]
    },
    "measurements": {
      "xrd": [
        {
          "file_path": "raw/track_b/mock/cc_mock_0004/xrd.raw",
          "instrument_id": "xrd_placeholder",
          "measurement_time": "2026-06-02T15:00:00Z",
          "raw_export_format": "placeholder_raw"
        }
      ],
      "spectroscopy": [],
      "microscopy": [],
      "photos": [
        {
          "file_path": "raw/track_b/mock/cc_mock_0004/photo_final.jpg",
          "timestamp": "2026-06-02T13:00:00Z"
        }
      ]
    },
    "labels": {
      "assigned_after_raw_data_frozen": true,
      "human_labels": [
        {
          "labeler_id": "labeler_placeholder",
          "label": "delayed_conversion_possible",
          "confidence": 0.5,